339,Lots of little kindnesses': Valuing the role of older Australians as informal volunteers in the community,"This paper describes the ways in which older people contribute to their communities and families as informal volunteers. It challenges current ways of thinking that assign an economic value to the productive activities undertaken by older people. Using qualitative data from a study of older people resident in Queensland, Australia, the paper explores the ways that older people contribute to their families and to the community and the outcomes associated with these activities. Two specific themes emerged from the data: first, the ways in which older people contribute to strong inter-generational relations, and second, how they provide essential mutual support that permits many older people to remain living in the community. These contributions, while often small in themselves, are in aggregate critical both to family functioning and to the maintenance of sustainable and healthy communities. Many are reciprocal interactions that add value to the lives of individuals and offer positive social roles in later life, and they may be particularly important for those from minority cultural backgrounds or at risk of social isolation. The findings suggest that older people are integral to community and civil society and, therefore, that social policy should respond to the ageing of Australia's population and recognise the positive contributions of older people, rather than emphasising the costs of demographic change. © 2005 Cambridge University Press.",0,0,"not SI, no tech",1,,,,,0.8049855463
270,Internet use and decision making in community-based older adults,"Use of the internet may provide tools and resources for better decision making, yet little is known about the association of internet use with decision making in older persons. We examined this relationship in 661 community-dwelling older persons without dementia from the Rush Memory and Aging Project, an ongoing longitudinal study of aging. Participants were asked to report if they had access to the internet and how frequently they used the internet and email. A 12-item instrument was used to assess financial and healthcare decision making using materials designed to approximate those used in real world settings. Items were summed to yield a total decision making score. Associations were tested via linear regression models adjusted for age, sex, race, education, and a measure of global cognitive function. Secondary models further adjusted for income, depression, loneliness, social networks, social support, chronic medical conditions, instrumental activities of daily living (IADLs), life space size, and health and financial literacy. Interaction terms were used to test for effect modification. Almost 70% of participants had access to the internet, and of those with access, 55% used the internet at least several times a week. Higher frequency of internet use was associated with better financial and healthcare decision making (β = 0.11, p = 0.002). The association persisted in a fully adjusted model (β = 0.08, p = 0.024). Interaction models indicated that higher frequency of internet use attenuated the relationships of older age, poorer cognitive function, and lower levels of health and financial literacy with poorer healthcare and financial decision making. These findings indicate that internet use is associated with better health and financial decision making in older persons. Future research is required to understand whether promoting the use of the internet can produce improvements in healthcare and financial decision making. © 2013 James, Boyle, Yu and Bennett.",0,0,not SI,1,,,,,0.6253989534
61,Enhancing social interaction between older adults and their families,"The rise of Internet and ubiquitous technologies have spread and diversified the social media used by people to interact among them. Unfortunately most older adults are not able to use these solutions. This situation isolates them and negatively affects their physical and mental health. Aiming to improve mood in older adults, and helping them overcome the negative effects of social isolation, we have developed a computer-based intermediary system, that we called Social Connector. This system is capable of boosting the social interaction between an elder and his/her close relatives; e.g. adult children and grandchildren. The system can also be used as a sensor of elders' social interactions and mood. The preliminary evaluation results indicate that the system is well accepted by older adults, and it can be used to boost social interactions with their relatives. © Springer International Publishing 2013.",0,0,no SI,1,,,,,0.5464161137
141,How community-dwelling seniors with multimorbidity conceive the concept of mental health and factors that may influence it: A phenomenographic study,"Multimorbidity, that is, the coexistence of chronic diseases, is associated with mental health issues among elderly people. In Sweden, seniors with multimorbidity often live at home and receive care from nursing aides and district nurses. The aim of this study was to describe the variation in how community-dwelling seniors with multimorbidity perceive the concept of mental health and what may influence it. Thirteen semi-structured interviews were analysed using a phenomenographic approach. Six qualitatively different ways of understanding the concept of mental health and factors that may influence it, reflecting key variations of meaning, were identified. The discerned categories were: mental health is dependent on desirable feelings and social contacts, mental health is dependent on undesirable feelings and social isolation, mental health is dependent on power of the mind and ability to control thoughts, mental health is dependent on powerlessness of the mind and inability to control thoughts, mental health is dependent on active behaviour and a healthy lifestyle, and mental health is dependent on passive behaviour and physical inactivity. According to the respondents' view, the concept of mental health can be defined as how an individual feels, thinks, and acts and also includes a positive as well as a negative aspect. Social contacts, physical activity, and optimism may improve mental health while social isolation, ageing, and chronic pain may worsen it. Findings highlight the importance of individually definitions of mental health and that community-dwelling seniors with multimorbidity may describe how multiple chronic conditions can affect their life situation. It is essential to organize the health care system to provide individual health promotion dialogues, and future research should address the prerequisites for conducting mental health promotion dialogues. Copyright © 2012 N. Dauman & S. I. Erlandsson.",0,0,no tech,1,,,,,0.0979055268
138,Homebound status increases death risk within two years in the elderly: Results from a national longitudinal survey,"Homebound status is associated with poorer physical and mental health, as well as disability in the elderly. We aimed to examine the prevalence and the role of homebound status on mortality in a representative sample of the French non-institutionalized population. This study included 7497 people aged 65 and over who were interviewed in 1999 and 2001 about the consequences of health problems on activities of daily living. Homebound status was defined as staying permanently inside the home, excluding an accident or a temporary illness. The influence of the homebound status on two-year mortality was assessed in a logistic regression model adjusted for the main confounders (age, sex, living as a couple, physical and mental impairments). The prevalence of homebound status was 4.7% (95% CI: 3.9-5.4) in this study. The number of homebound elderly was estimated at 421. 000 in France. The prevalence of homebound status increases with age and reaches 33.9% in people aged 95-99 years (95% CI: 13.1-54.6). Compared to non-homebound subjects, homebound elderly were more likely to be female, widower, to live alone and to have had a former low level job. Homebound status was associated with a number of physical and mental impairments. It increased the risk of dying within two years with an adjusted OR 3.45 (95% CI: 2.66-4.46). Homebound status should be considered as an indicator of frailty and used in the identification of old people likely to benefit from preventive interventions. © 2012 Elsevier Ireland Ltd.",0,0,no tech,1,,,,,0.9283481707
302,Impression management work: How seniors with chronic pain address disruptions in their interactions,"Chronic pain is an illness that affects nearly a third of senior citizens. Uncontrolled chronic pain can manifest constantly and/or intermittently, and can disrupt seniors' ability to plan or to maintain synchronous and scheduled contact with others. Such disruptions can expose seniors to stigma from others who do not understand this illness, social isolation, and a range of challenges to their social autonomy. We present results from an interview study of 27 seniors with chronic pain exploring how they mitigate and manage these disruptions in their lives. Drawing on Goffman's theory of impression management, we found that participants invested significant effort into controlling both the context of interactions and others' expectations, in order to mitigate the potential negative social consequences of disruptions. In performing this work, seniors were selective about what information they revealed to others about their chronic pain and availability. Given such efforts, seniors with chronic pain have unique needs for technologies to support their social interactions. © 2012 ACM.",0,0,"not SI, no tech",1,,,,,0.9045691199
209,Lesbians over 60 speak for themselves.,"With all its faults, this study, begun in 1983, is the first attempt to reach a nationwide representation of lesbian elders in order to gather information about their background, their relationship with their families of origin, and, for those married to men, with their husbands, children, and grandchildren. It explores their sexual behavior, both their physical and psychological health, and how aging has affected them. With the relatively meagre data available, it tries to make some comparison between lesbians and gay men over 60. All of this is just a beginning, an effort, it is hoped, that will encourage researchers to investigate further this hidden population that is another fascinating component of our diverse society. Through our research, we established that gay women of advanced age, as we have long surmised, are everywhere. Like their younger cohorts, they live in all regions of America, rural as well as urban. They come in all colors and are from all occupations: professional, business, clerical, trades, domestic work, and land management, to name a few. Many of them are now retired. Their formal education ranges from high school diplomas to doctorate degrees. A few are financially well off, while another few live below the poverty line. The rest enjoy reasonable comfort in their own homes, on modest incomes. In both political and religious affiliation, they tend to be liberal. Their sexual history runs the gamut from exclusively homosexual, through equally homosexual and heterosexual, to asexual. As they age and sex becomes a less significant part of their relationships, companionship grows more important. They prefer to associate with other lesbians within 10 years of their own age, whom they meet in community social groups, through friends, or at work--but not in bars. They do not relish the thought of ending their lives in any institution for the aged, but would consider a gay/lesbian intergenerational retirement community acceptable. Their most serious problems, even with the advantaged group surveyed, are those that affect many women of advanced age in our society: loneliness and economic worries. Although the feminization of poverty has been a topic under public scrutiny for some time, because it involves women of all ages, less attention has been paid to it in relation to the elderly. The equally disabling condition brought on by their isolation and loneliness has also been disregarded.(ABSTRACT TRUNCATED AT 250 WORDS)",0,0,no tech,1,,,,,0.5436146526
27,The role of socio-demographic variables in the use of internet-based applications by older people [El papel de las variables sociodemográficas en el uso de las aplicaciones basadas en Internet por los mayores],"The world's population is progressively aging. It is forecast that in 2050 the number of people over the age of 60 will reach two billion. The use of information and communication technologies (ICTs) could have a significant impact on the quality of life of the older population, helping to make them more active while decreasing their marginalization and social isolation. Although there are significant differences in use of the Internet and its applications by older adults compared to the rest of the population, it must be borne in mind that this segment is not a homogenous group. This work seeks to verify whether there are differences in the frequency of use of diverse Internet-based applications by older adults based on their age, gender, level of education and past employment activity. The results show that there are indeed significant differences in the use of certain applications due to the socio-demographic variables analyzed.",0,0,"no intervention, no SI, survey",0,,,,,0.9846257883
105,Social functioning of elderly persons with malignant diseases [Socijalno funkcionisanje starijih osoba obolelih od malignih bolesti],"Background/Aim. Malignant disease, its treatment and consequences of treatment can often lead to social marginalization and reduced quality of life. The aim of this research was to determine how elderly patients with malignant diseases function in their social environment. Methods. Sociodemographic questionnaire and interview were used to investigate a group of 49 elderly persons undergoing adjuvant chemotherapy treatment against early carcinomas (P1), and a group of 51 elderly persons with advanced stages of cancer undergoing systemic chemotherapy (P2). There were two cycles of assessment: one just before the beginning of the first cycle of adjuvant or systemic chemotherapy, and the other three months later. The research paradigm was based on the relation between individual treatment and the impact of the malignant disease on functional and social incompetence. The obtained findings were compared with the group of 50 healthy elderly people (K) who share the same relevant features but do not suffer from malignant diseases. Results. It was found that most healthy older people live in share house, whereas those who suffer from malignant diseases mostly live in separate households. In both groups of patients and healthy group older people are mostly taken care of by their children. Individuals in both groups of patients have been frequently visited by their relatives during initial stages of treatment, unlike the elderly people in the control group. However, the difference did not reach a statistical significance. Three months after the beginning of chemotherapy, there was a statistically relevant difference in favor of the group undergoing adjuvant treatment. Home visits eventually become less frequent, whereas communication by telephone becomes more frequent. It was also found that visits by friends and neighbors are statistically more frequent among subjects who undergo adjuvant treatment, both before the treatment began and three months later when compared to other groups. Conclusion. Our research shows that elderly people are subject to social exclusion, especially those with malignant diseases. Special care should be dedicated to monitoring of social functioning during treatment of patients with malignant disease considering the detected trend of deterioration and significance for further recover and cure. © 2015, Vojnosanit Pregl. All rights reserved.",0,0,no tech,1,,,,,0.9201197686
152,Loneliness and Ethnic Minority Elders in Great Britain: An Exploratory Study,"Loneliness, which describes the deficit between an individuals' expectation of the quality and/or quantity of social relationships and the actuality, is associated with poor quality of life, negative health outcomes and, in some cases, increased use of statutory services. Within Great Britain few studies have examined the prevalence of loneliness amongst older people from ethnic minorities. In this exploratory study we consider the prevalence of loneliness amongst older people, those aged 65 years and over, from the key minority groups growing old in Britain (Indian, Pakistani, Bangladeshi, African Caribbean, and Chinese) and draw explicit comparisons for these groups with the prevalence of loneliness reported for the general population and with older people in their countries of origin. We use two data sources: the Ethnicity and Loneliness Survey, a study of 300 minority elders aged 65+ living in the community, provides our prevalence estimates and secondary analysis of a study of 169 South Asian elders (aged 65+) undertaken in Birmingham to validate our prevalence rates for the Indian and Bangladeshi populations. We identified very high rates of reported loneliness, ranging from 24% to 50% amongst for those elders originating from China, Africa, the Caribbean, Pakistan and Bangladesh whilst those from India approximated to the norms of 8-10% for Britain. These results suggest that it is feasible to research loneliness amongst minority communities in Britain; that the levels of loneliness are, with the exception of the Indian population, very much higher than for the general population but are broadly comparable with rates of loneliness reported for older people in their countries of origin. There is a rich research agenda to be developed in extending our understanding of loneliness in later life amongst the increasingly culturally and ethnically diverse older population of Great Britain. © 2012 Springer Science+Business Media, LLC.",0,0,no tech,1,,,,,0.3073088371
190,Predictors and subjective causes of loneliness in an aged population,"The aim of the study was to examine the prevalence and self-reported causes of loneliness among Finnish older population. The data were collected with a postal questionnaire from a random sample of 6786 elderly people (≥75 years of age). The response rate was 71.8% from community-dwelling sample. Of the respondents, 39% suffered from loneliness, 5% often or always. Loneliness was more common among rural elderly people than those living in cities. It was associated with advancing age, living alone or in a residential home, widowhood, low level of education and poor income. In addition, poor health status, poor functional status, poor vision and loss of hearing increased the prevalence of loneliness. The most common subjective causes for loneliness were illnesses, death of a spouse and lack of friends. Loneliness seems to derive from societal life changes as well as from natural life events and hardships originating from aging. © 2005 Elsevier Ireland Ltd. All rights reserved.",0,0,no tech,1,,,,,0.2719038762
168,"Quality of life in community-dwelling older people in Ireland: Association with ageing perceptions, physical health and psychological well-being","Quality of life (QoL) is a key outcome variable in determining the success of health and social policy. Often, QoL is assessed in a context where health or well-being are compromised. This study sought to explore individually defined QoL among older people living in the community in Ireland and to examine its determinants, including health and psychological well-being, and perceptions of ageing. A national randomly selected sample of community-dwelling older people (aged 65+) in the Republic of Ireland and Northern Ireland (N = 1,815) were interviewed in their homes. QoL, health and social status, and perceptions of ageing were assessed. The mean QoL score was high (78.5, SD = 18.1). Higher QoL was associated with higher social class, better self-assessed health, fewer functional impairments and lower levels of depression and loneliness (all p < .001). Higher QoL was also associated with more positive perceptions of ageing. While QoL for this older population was high, it was significantly negatively affected by lower socio-economic status and negative perceptions of ageing. © 2010 by The Psychological Society of Ireland.",0,0,no tech,1,,,,,0.9026834225
255,"What about us, seniors? What difficulties do we face using Information and Communication Technology?","In a society marked by rapid demographic ageing and constant technological advances, investing in studies that promote communication and lessen social isolation is justified. This study aims to present the main difficulties seniors face using Information and Communications Technology (ICT), particularly computers; writing and formatting text, accessing the Internet to browse and do research; and using asynchronous and synchronous communication services like email and instant messaging. For conducting this study, partnerships were established with four Private Institutions for Social Solidarity in the municipality of Aveiro, within the scope of the SEDUCE project. The tools used for data collection were two questionnaire surveys and a field journal. The study included the participation of 22 seniors who used ICTs twice a week, in a total of 80 sessions of 90 minutes each. The results suggest that, although seniors experience countless and various difficulties, they are motivated, interested and determined to make the effort of integrating this activity into their daily life. © 2015 IEEE.",0,0,not SI,1,,,,,0.2263879868
131,Original research: Loneliness and quality of life in chronically ILL rural older adults,"Background: Loneliness is a contributing factor to various health problems in older adults, including complex chronic illness, functional decline, and increased risk of mortality. OBJECTIVES: A pilot study was conducted to learn more about the prevalence of loneliness in rural older adults with chronic illness and how it affects their quality of life. The purposes of the data analysis reported here were twofold: to describe loneliness, chronic illness diagnoses, chronic illness control measures, prescription medication use, and quality of life in a sample of rural older adults; and to examine the relationships among these elements. Methods: A convenience sample of 60 chronically ill older adults who were community dwelling and living in Appalachia was assessed during face-to-face interviews for loneliness and quality of life, using the University of California, Los Angeles (UCLA) Loneliness Scale (version 3) and the CASP-12 quality of life scale. Chronic illness diagnoses, chronic illness control measures, and medication use data were collected through review of participants' electronic medical records. Results: Overall mean loneliness scores indicated significant loneliness. Participants with a mood disorder such as anxiety or depression had the highest mean loneliness scores, followed by those with lung disease and those with heart disease. Furthermore, participants with mood disorders, lung disease, or heart disease had significantly higher loneliness scores than those without these conditions. Loneliness was significantly related to total number of chronic illnesses and use of benzodiazepines. Use of benzodiazepines, diuretics, nitrates, and bronchodilators were each associated with a lower quality of life. CONCLUSIONS: Nurses should assess for loneliness as part of their comprehensive assessment of patients with chronic illness. Further research is needed to design and test interventions for loneliness.",0,0,no tech,1,,,,,0.005539913763
