309,Psychosocial correlates of aspects of sleep quality in community-dwelling Irish older adults,"Objectives: While it is known that psychosocial factors affect overall sleep quality, there is little consensus on the factors that affect different aspects of sleep. The Pittsburgh Sleep Quality Index (PSQI) provides a means of examining these separate aspects of sleep. Method: This study investigated whether the different components of the PSQI are affected by different psychosocial factors, or whether all aspects of sleep are associated with the same factors. 505 community-dwelling older adults took part in this study. Psychosocial status, comprising of measures of depression, anxiety, perceived stress, social and emotional loneliness and personality, was assessed for each participant. Health-related factors (pain, comorbidities, polypharmacy) as well as age and gender were also measured. Results: Neuroticism, depression, anxiety and age accounted for overall sleep quality. Further analyses revealed that different psychosocial and health-related factors such as pain, loneliness and personality accounted for scores in the different components. Conclusion: Interventions for poor sleep quality may depend on the aspect of sleep affected in the individual, and treatment may be contingent on a number of different psychosocial variables. Future research could focus on developing personalised treatment programs for older adults with sleep complaints. © 2011 Taylor & Francis.",0,0,"not SI, no tech",1,,,,,0.8571186805
146,Happiness among community-dwelling older persons: Is it related to pain and loneliness?,"Given the global increase in the aging population, it is necessary to focus on psychological well-being among older persons in addition to maintaining physical health, thus enabling them to achieve healthy aging. Method: It was an exploratory cross-sectional design. Results: A total of 78 older adults (20 males and 58 females) from four community elderly centers were invited, with a mean age of 75.22. The mean happiness score was 7.44 ± 1.91. There were no significant differences in happiness in most of the demographic data; except relationship with family members and economic resources (p< 0.05). This showed that Chinese older persons with better family relationships and greater financial stability felt happier. Also, happiness was positively correlated with life satisfaction and social network and negatively correlated with loneliness and chronic pain. Conclusion: It is important to enhance the happiness and psychological well-being of older adults and allow them to enjoy their longevity in the community. © Nova Science Publishers, Inc.",0,0,no tech,1,,,,,0.2757265931
210,Growing old and lonely in different societies: Toward a comparative perspective,The main argument of this paper is that the subjective experience of loneliness among older people must be analyzed in relation to the overall value system of society or the subcultural values of particular segments of society. Cultural or subcultural value systems are contrasted in terms of whether they give priority to individualistic values or to collective values such as family or community bonds. These differences in value systems result in important differences in people's social contacts and socioemotional bonding experiences as well as their level of satisfaction with a given level of social relationships. It is suggested that these differences must be looked at in relation to basic human needs for social bonding as well as needs for individuation. The concept of the loneliness threshold is introduced to identify the level of social contacts that individuals desire to avoid the experience of loneliness or emotional isolation. © 1987 D. Reidel Publishing Company.,0,0,no tech,1,,,,,0.8433289926
280,Elderly mental health: Needs,"This paper highlights the mental health needs of the elderly. It tackles the issues of their institutionalisation and community care. Rapid urbanisation in Indian society throws up special problems in elderly care. There is great evidence of a raise in morbidity, mortality, hospitalisation and loss of functional status related to common mental disorders in the elderly patients. Overlap of depression and anxiety is very common with up to almost half of the elderly patients reporting significant depressive and anxiety symptoms. Also, depression is the most common psychiatric disorder in late life. Growth in the elderly population means a direct increase in age related diseases such as dementia and poor mental health outcomes such as depression, anxiety, suicide and serious constraints on the quality of life among elderly individuals. The need to identify new and unmet problem areas and develop efficient therapeutic outcomes for this special population is stressed.",0,0,"not SI, no tech",1,,,,,0.7122434114
278,Helping older adults to live better with hearing and vision losses,"Because vision and hearing impairments increase in prevalence as age increases, professionals who work with older adults in community settings often encounter people with a wide range of difficulties with their vision and/or hearing. These problems can range from locating financial support to purchasing glasses or hearing aids to obtaining in-home training and devices that will make it possible for the individual with a sensory disability to continue living independently. Meeting the needs of these people requires that professionals be able to recognize sensory losses, accommodate for them, and help older adults to understand and cope with them.",0,0,not SI,1,,,,,0.5350511073
185,The social relations of the elderly,"The aim of the study was to investigate the social life of the elderly, their level of satisfaction with friendships and their opinions on loneliness and their ability to be alone in old age. A cognitive deterioration test was administered to 956 self-sufficient elderly people. This was a scale to assess their perception of loneliness and a questionnaire on their opinion of loneliness. From the descriptive analyses and comparison with the average results, it appears that elderly people are fairly satisfied with their social life and they believe that loneliness can condition the quality of life and the ability to be alone. The research also revealed that environmental characteristics and social integration are important for achieving a satisfactory lifestyle. © 2007 Elsevier Ireland Ltd. All rights reserved.",0,0,no tech,1,,,,,0.9545856473
293,Why do i always feel tired Evaluating older patients reporting fatigue,"Fatigue is a common symptom in elderly persons, but it is often ignored as many patients and healthcare providers assume it is a natural progression of aging or may mistake it for somnolence, dyspnea, or muscle weakness. Since its importance is often underestimated, patients with fatigue may not receive an intervention, potentially resulting in significant functional decline. This article discusses the importance of identifying the underlying etiology or etiologies of a patient's fatigue so that it can be eliminated, if possible, or managed appropriately. History-taking, including consideration of the patient's symptom severity, is the most important part of evaluating fatigue. The authors present an algorithm that can be used to help identify the cause of a patient's fatigue.",0,0,"not SI, no tech",1,,,,,0.6450206908
217,"An evaluation of congregate meal programs and health of elders: Scott County and Fort Smith, Arkansas Agric. Exp. Stat., Bulletin 808, July 1976",Study evaluates the impact of selected aspects of a congregate meal program on the health status of the elderly at one rural and one urban site in Arkansas. Data were gathered from interviews with 50 participants and 50 nonparticipants at each site in June-July 1975. Findings show participants sampled spent less time in bed due to illness than nonparticipants (15 days versus 29 days). Also rural participants sampled who had been hospitalized spent an average of 10 nights during the year while rural nonparticipants averaged 28 days of hospitalization. Respondents were unanimous in their praise of the hot meals program and all but one wanted to see it expanded. Ninety-one percent indicated they appreciated social interaction with others more than any other aspect of the program. The greatest single need expressed was to see more people participating. Most felt the program had done them some good physically and mentally. The main conclusion drawn from this pilot study is that congregate meal programs can provide an avenue for the elderly to avoid malnutrition and some of the associated hospitalization due to crisis conditions along with social isolation and its debilitating aspects.,0,0,no tech,1,,,,,0.1229542161
243,Effects of perinatal exposure to delta-9-tetrahydrocannabinol on the emotional reactivity of the offspring: A longitudinal behavioral study in Wistar rats,"Rationale: The endocannabinoid system plays a crucial role in the control of emotionality and recent clinical findings have shown that heavy prenatal exposure to cannabis is significantly associated with self-reported anxiety symptoms in exposed children. However, the long-term neurobehavioral consequences of in utero exposure to low-moderate doses of cannabinoid compounds have never been investigated. Objective: The objective of this study was to investigate whether perinatal exposure to moderate doses of the active constituent of cannabis, the CB1 cannabinoid receptor agonist delta-9-tetrahydrocannabinol (THC), influences the emotional reactivity of rat offspring. Methods: Primiparous Wistar rats were treated during pregnancy and lactation with doses of THC equivalent to the current estimates of moderate cannabis consumption in humans (2.5-5 mg kg-1, per os, from gestational day 15 to postnatal day 9). The emotional reactivity of infant, adolescent, and adult offspring was investigated using the isolation-induced ultrasonic vocalization, social interaction, and elevated plus-maze tests, respectively. Results: Perinatal THC treatment did not affect parameters of reproduction; however, at the dose of 5 mg kg-1, it increased the number of ultrasounds emitted by rat pups removed from the nest, inhibited social interaction and play behavior in the adolescent offspring, and induced an anxiogenic-like profile in the adult offspring tested in the elevated plus-maze test. Conclusion: These results suggest that the endocannabinoid system is involved in the control of emotionality since early developmental stages. Thus, even moderate doses of cannabinoid compounds, when administered during the perinatal period, can have profound consequences for brain maturation, leading to long-lasting neurodevelopmental alterations. © 2008 Springer-Verlag.",0,0,"not OA, not SI, no tech",1,,,,,0.9368999462
264,Pervasive computing technologies to continuously assess Alzheimer's disease progression and intervention efficacy,"Traditionally, assessment of functional and cognitive status of individuals with dementia occurs in brief clinic visits during which time clinicians extract a snapshot of recent changes in individuals' health. Conventionally, this is done using various clinical assessment tools applied at the point of care and relies on patients' and caregivers' ability to accurately recall daily activity and trends in personal health. These practices suffer from the infrequency and generally short durations of visits. Since 2004, researchers at the Oregon Center for Aging and Technology (ORCATECH) at the Oregon Health and Science University have been working on developing technologies to transform this model. ORCATECH researchers have developed a system of continuous in-home monitoring using pervasive computing technologies that make it possible to more accurately track activities and behaviors and measure relevant intra-individual changes. We have installed a system of strategically placed sensors in over 480 homes and have been collecting data for up to 8 years. Using this continuous in-home monitoring system, ORCATECH researchers have collected data on multiple behaviors such as gait and mobility, sleep and activity patterns, medication adherence, and computer use. Patterns of intra-individual variation detected in each of these areas are used to predict outcomes such as low mood, loneliness, and cognitive function. These methods have the potential to improve the quality of patient health data and in turn patient care especially related to cognitive decline. Furthermore, the continuous real-world nature of the data may improve the efficiency and ecological validity of clinical intervention studies. © 2015 Lyons, Austin, Seelye, Petersen, Yeargers, Riley, Sharma, Mattek, Wild, Dodge and Kaye.",0,0,not SI,1,,,,,0.4889376562
28,Retirees on facebook: Can online social networking enhance their health and wellness?,"An individual's social network has a strong impact on his or her mental and physical health. This is of particular consequence for senior citizens who are at greater risk of social isolation after retirement, due to loss of spouse, mobility issues, and recent emphasis on aging in place, i.e., in smart homes. Can online social networking sites (SNSs) such as Facebook help alleviate social isolation of aging alone by enabling seniors to maintain high-quality social interactions? How can we make senior-friendly design improvements to SNSs? A preliminary national survey (N=168) of adults over 55 revealed that for those who had joined an SNS, the primary motivation cited for signing up was persuasion by a friend or family member, while nonusers cited a strong lack of interest rather than a lack of knowledge or skill, with implications for theory and design of SNS technology for senior citizens.",0,0,"no intervention, no SI, survey",0,,,,,0.9205671396
340,Do older people who self-harm receive the hospital care they need?,"Although self-harm is most common in younger people in Britain, the risk of suicide subsequent to an initial act of self-harm is considerably greater in older age groups. Four characteristics have been shown to be associated with increased vulnerability in older people who self-harm: increased suicidal intent, physical illness, mental illness and social isolation. This paper is part of a broader analysis of all self-harm presentations to a British hospital accident and emergency department over a five-year period. It examines the prevalence of these vulnerability indicators in patients aged 65 or over, and considers whether greater vulnerability in older patients is reflected in their clinical management within the hospital and in community support planning on discharge. At the first presentation older patients (n=91) exhibited greater vulnerability than did younger patients (n=2,326). Despite this, we found no evidence that older self-harm patients were any more likely than younger patients to routinely receive either a psychosocial assessment from a member of staff with specialist mental health training, or community aftercare planning on discharge from the hospital. This study lends weight to recently published national guidelines recommending that all acts of self-harm in older people be regarded as evidence of serious suicidal intent at the outset. © Pavilion Publishing 2004.",0,0,"not SI, no tech",1,,,,,0.7400540902
268,Fit-for-life of future emerging technology,"Purpose: Emerging ICT technology is often viewed as obscure and unpleasant by older people1. In addition, it is associated with a variety of ethical considerations2. In many cases, older people find it difficult to imagine a role for modern ICT technology in their everyday lives, since technology of this kind does not necessarily fit in with the forms of life of this target group. This is most often due to the failure of ICT design paradigms to address the issues involved in living a good life. Traditionally, the core user challenge in ICT design has been associated with the immediate usage situation. Human-centred approaches such as contextual design, scenario-based design, and design with personas strive to design technology based on an investigation of what people could do with a given technology and how they actually use it. However, to ensure that products and services fit in with people's goals, it is imperative that we ask why people would adopt and use a certain technology in their lives. An analysis of people's lives (and personal characteristics) and living conditions is necessary in order to answer this question. In addition, clear conceptualisations and methodological models are required in order to describe how such knowledge of technology design processes might be applied. A model for a multi-dimensional and holistic Life-Based Design (LBD) has been introduced on these grounds3,4. This approach emphasises analysis of the role of technology in human life: facts and values related to forms of life, as a basis for the creation of design ideas and for concept design. Method: Part of LBD consists of a fit-for-life analysis, which examines the benefits and meaningfulness people can derive from the solutions developed, as well as the impact that such solutions can have on everyday life. It illustrates the logic involved in enhancing quality of life (QoL), presupposing a thorough understanding of the concept and content of QoL, particularly the reassessment of QoL parameters in relation to everyday life supported by technology. When designing for quality of life, it is necessary to understand what is relevant to people's values. Fit-for-life analysis thus includes an analysis of the relevant biological, psychological, and socio-cultural attributes of forms of life, and examines the ethical problems that may be created by technology. Results & Discussion: Fit-for-life analysis calls for a clarification of the issue of according to whose perspectives technology can contribute yielding higher value in improving quality of life. The outcome could lead to improvements in and modifications of product ideas. Technology is empowering when designed to be fit for the lives of older people. For example, it can enhance capabilities and self-efficacy and promote a feeling of security and ability to cope with life, while preventing loneliness and enabling participation in working life and social activities.",0,0,not SI,1,,,,,0.2841800129
207,Social Isolation and Social Support: An Applied Perspective,"Considerable empirical evidence substantiates the importance of social networks and support to health and well-being among the elderly. But considerably more research is necessary before successful interventions can be more generally implemented to positively alter an elder's network. In this article, the authors discuss social supportand isolationfrom an appliedperspective. They have combined presentations originally made at a National Institute on Aging-sponsored symposium on applied gerontology held in August 1992. They make some general observations concerning the field of applied social relations in later life, describe the mental health aspects of these relations, list some fundamental principles and existing technology for this field, describe the use of a brief screening instrument for social isolation developed by one of the authors (Lubben), and explore varying domains of knowledge concerning elder soical relations. They conclude by outlining some areas that they see as requiring the attention of an applications perspective to social support and isolation m the near future. © 1994, Sage Publications. All rights reserved.",0,0,no tech,1,,,,,0.3413423523
244,"Isolation and the timing of mammary gland development, gonadarche, and ovarian senescence: Implications for mammary tumor burden","In this study of Norway rats, we hypothesized that lifelong psychosocial experiences, social isolation or group living, trigger different developmental trajectories in the ovarian system, contributing to predisease pathways for spontaneous mammary tumors. Epidemiological studies indicate that early puberty and delayed menopause are risk factors for breast cancer. To that end, we took a cross-sectional, prospective approach and examined the ovarian system at two developmental points, young adulthood and middle age. We assessed ovarian function at both points, as well as mammary gland development at puberty and mammary tumor burden in middle age. Social isolation dissociated two components of puberty; it accelerated maturation of ovarian function while it simultaneously delayed mammary tissue development thereby increasing the exposure of developing breast parenchyma to high levels of estrogen. By mid-life, socially isolated rats had greater tumor burden despite having entered estropause prematurely, demonstrating that isolation did not increase tumorigenesis by prolonging ovarian function. These findings are discussed in the context of facultative lifespan strategies for rats born at different times of year and those living in isolation or in a large burrow community. © 2008 Wiley Periodicals, Inc.",0,0,"not OA, not SI, no tech",1,,,,,0.3059262544
260,Adaptive engagement of older adults' fitness through gamification,"Many older adults lead sedentary lifestyles, as the challenges of aging can complicate efforts to maintain a healthy level of physical activity. These challenges can include decreasing strength, reduced mental capacity, social isolation, and the development of chronic health conditions. My PhD research attempts to analyze the needs and challenges of older adults and review their attitudes and motivations towards physical activity (PA). Furthermore, I aim to investigate various approaches in the development of socially interactive fitness activity programs, with the goal of increasing positive lifestyle motivations and quality of life (QoL). This research defines a taxonomy of motivational and personality characteristics of older adults to engage in PA. Lastly, this dissertation proposes the development of an adaptive application that addresses fitness gamification from the motivational perspective of an older adult. This application will empower older adults to engage in PA as a means to gain freedom, mobility and social interdependence within their public spheres. © 2015 ACM.",0,0,not SI,1,,,,,0.8558969583
206,It can never be the way it was: helping elderly women adjust to change and loss.,"This article was written to help nurses assist elderly women adjusting to change and loss. It describes dynamics that may be present, such as loneliness and powerlessness.",0,0,no tech,1,,,,,0.6952250816
296,Gender and polypharmacotherapy in the elderly: A clinical challenge,"Polypharmacotherapy is a major concern in the elderly and especially in older women after the age of 80. It results from the intake of prescription and non-prescription drugs, being often a problem of evidence-based therapy. Besides the fact that women live longer than men and outnumber them, reasons for polypharmacy in women are diverse and include a different attitude towards intake of drugs between men and women, the propensity of women to rather see a physician and talk about their problems, the load of family responsibility as women are the main caregivers within a family, the influence of physician sex on patient care, the level of education, social deprivation and self-rated health. Women are more often prescribed potentially inappropriate medication and more often become victims of adverse drug reactions. This is not only due to the number and quality of drugs prescribed but also to differences in pharmacokinetics and - dynamics which make them more vulnerable to drug exposure. Thus, inappropriate prescribing contributes to hospitalization, poor quality of life, costs, compliance issues and poor outcomes. More preclinical and clinical studies with elderly patients and especially elderly women are needed to study the underlying mechanisms of the pharmacologic differences and obtain more insight into the difference in risk between men and women. Attention to prescribing of medications, consistent review of medication lists, and reevaluation of indications and outcomes of prescribing are essential to ensure that drugs are used appropriately in elderly women, polypharmacy is minimized and safety for patients is maximized. © 2012 Springer-Verlag Berlin Heidelberg.",0,0,"not SI, no tech",1,,,,,0.3467134259
