348,Nutritional risk assessment and obesity in rural older adults: A sex difference,"Background: Many older Americans are overweight or obese, but it is unclear whether obesity is associated with other nutritional risk indicators. Objective: This study investigated sex-associated differences in nutritional risk among community-dwelling, rural older adults and determined whether weight status [body mass index (BMI; in kg/m 2) and waist circumference] was related to other measures of nutritional risk. Design: This cross-sectional study explored relations between weight status and nutritional risk, which was determined on the basis of the Level II Screen, overall diet quality, nutrient intakes, and plasma biomarkers. Results: Of the 179 subjects, 44% were overweight (BMI 25-29.9) and 35% were obese (BMI &gt; 30). There were few differences in nutrient intakes between older men and women after we controlled for energy intake. In women, BMI was directly associated with multiple additional nutritional risk indicators, including the number of Level II items (r = 0.30), intakes of fat (r = 0.26) and saturated fat (r = 0.21), and homocysteine concentration (r = 0.25). Weight status in women was inversely associated with intakes of carbohydrates (r = -0.25), fiber (r = -0.35), folate (r = -0.24), magnesium (r = -0.29), iron (r = -0.22), and zinc (r = -0.23); Healthy Eating Index scores (r = -0.22); and plasma pyridoxal 5′ phosphate (r = -0.30). Associations with waist circumference were similar. In men, weight status was associated only with plasma cobalamin (r = -0.33 for BMI) and pyridoxal 5′ phosphate (r = -0.24 for waist circumference). Conclusions: Overweight and obese older women, particularly those living alone, may be at greater nutritional risk than are men with a high BMI. Targeted nutritional intervention emphasizing nutrient-dense food choices to improve dietary patterns may be warranted.",0,0,"not SI, no tech",1,,,,,0.4979921195
70,User interface of multimedia delivery platform for the elderly,"The world is facing the phenomena of rapidly growing population of the aged, in which there are more elderly people than children. The elderly people tend to live longer and hence have to live alone and feel lonely in large part due to healthcare advancement globally and structural social changes. This causes a great deal of concerns for loneliness, social isolation, and depression among the elderly. The elderly people also have mobility and vision-reducing eye problems. Therefore, it is important for the family to provide the proper health and social care environment to assist the elderly's daily living in order to enable them to live quality lives. This study aims to design and develop an interactive (bidirectional) multimedia delivery system to deliver multimedia contents among elderly people, family members, relatives and friends, and healthcare providers. The elderly can chat and send multimedia contents from a tablet PC via smart TV to family members and friends. Multimedia contents and the chat history are displayed on the elderly's smart TVs. The elderly can control the smart TV multimedia delivery application with ease by using our developed tablet PC touchpad features. It is intended to enhance the quality of lives of the elderly people by allowing them to stay connected with the family members, relatives and friends, in hope to replace the TV remote control, which is deemed not to be so user-friendly.",0,0,"no SI, no intervention",0,,,,,0.2474404678
40,Design and Technologies for Understanding Older Adults Social Interactions in Retirement Communities,"Social interactions in retirement communities' shared spaces are a key component to preventing social isolation and loneliness among older people. Given the underutilization of these spaces, placing technologies to promote utilization of- and socialization in- shared spaces might improve independence and quality of life among older adults. The purpose of this paper is to describe the design, development, and technology studies conducted for understanding the social interactions of older adults in retirement communities. To understand current use of shared spaces, observational studies were conducted in a retirement community. Moreover, interventions were implemented to evaluate the impact of designed technologies in shared spaces. The results motivate the need for an automated behavioral mapping surveillance system to quantify social interactions among older adults and technology interventions in retirement communities' shared common areas. This paper describes the development of a video-based analysis system for understanding social interactions among older adults in retirement communities. Specific emphasis is given to describing the automated behavioral mapping surveillance system designed to monitor the number, length, and type of interactions of older adults in retirement communities. We hypothesize that social interactions amongst older adults can be detected using video cameras and microphones strategically placed in the environment, and discuss the development of a surveillance system specifically for quantifying social interaction. This study is relevant for the field of social robotics as an example of a realistic application domain. © 2013 Springer Science+Business Media Dordrecht.",0,1,no remote,1,,,,,0.5475722683
189,The experience of loneliness of battered old women,"The present article is part of a larger study examining the life stories of battered old women (Buchbinder & Winterstein, 2003; Winterstein, 2002). It is based on long in-depth interviews with twenty-one aging women who lived with violence for a significant portion of their lives. While the larger study examines a broad range of their experience, including loneliness, regret, expectations of the future, and an attempt to build a monument to their suffering, the present study focuses on loneliness, which appears to constitute the central theme of their existential experience. Content analysis of the interviews shows that loneliness is experienced on all ecological levels, including the self, the family of origin, the violent partner, the children, and the extended family. It also permeates the social relationships of the women and becomes the predominant motif of their social interactions. The combination of loneliness, violence, and old age creates suffering that colors everyday life and becomes not only the constant background against which life unfolds but also the governing variable in their experience. Their cognitive maps, emotional world, and overall sense of self, as well as their sense of existential continuity in the world are all affected by loneliness. © 2005 by The Haworth Press, Inc. All rights reserved.",0,0,no tech,1,,,,,0.1431854133
308,"Elder abuse and self-neglect ""I don't care anything about going to the doctor, to be honest.... ""","Elder mistreatment encompasses a range of behaviors including emotional, financial, physical,andsexual abuse, neglect by other individuals, and self-neglect. This article discusses the range of elder mistreatment in community-living older adults, associated factors,andconsequences.Although self-neglect is not considered a type of abuse in many research definitions, it is the most commonly reported form of elder mistreatment and is associated with increased morbidity and mortality. The case on which this article is based describes a 70-year-old woman who neglects herself and dies despite multiple contacts with the medical community. Despitesignificantgapsinresearch, enoughisknowntoguide clinical practice. This article presentsthepracticalapproaches a health care professional can take when a reasonable suspicion of elder mistreatment arises. Public health and interdisciplinary team approaches are needed to manage what is becoming an increasing problem as the number of older adults around the world increases. ©2011 American Medical Association. All rights reserved.",0,0,"not SI, no tech",1,,,,,0.06505912746
36,Toward a companion agent for the elderly - The methods to estimate at-home and outside-home daily life activities of the elderly who live alone,"With advances in medical technology, people's life have been extended, and there are more and more older adults isolated. If they do not maintain social life with others, they may feel loneliness and anxiety. For their mental health, it is reported effective to keep their social relationship with others, for example, the conversation with their caregivers or other elderly people. Active listening is a communication technique that the volunteer listener listens to the speaker (the elderly) carefully and attentively by confirming or asking for more details about what they heard. This helps to make the elderly feel cared and to relieve their anxiety and loneliness. This paper presents our in-progress project aiming to develop a framework of a virtual companion agent who is always with the user and can engage active listening to maintain a long-term relationship with elderly users. In order to achieve the agent's companionship with the user for a longer period, we believe that it is essential to make the agent to understand the user as best as it can. This kind of user-fitted conversation is not addressed in previous companion agent work. The proposed approach is the acquisition of the ""memory"" of the user's daily life in two situations, at-home and outside-home. In the former one, multiple Microsoft Kinect depth sensors were adopted. The depth information is integrated to detect the user's position and posture and then to estimate the user's daily activity. In the outside-home configuration, the prototype application is an Android smartphone application that recognizes the user's moving status with the information from the on-board three-axis accelerometer as well as the location of the user from GPS information. These data are then used to estimate the user's outside-home activity. All estimated daily activities are recorded in an activity history database. Both the at-home and outside-home activity estimation methods have been developed and have been evaluated in a laboratory environment with student subjects at a moderate accuracy. The interface of the companion agent is being designed with the results from human-human and human-agent (driven by the data from the human listener condition) subject experiments. After the technologies are more matured, we would like to conduct real-world experiment with elderly subjects in near future. © 2014 Springer International Publishing.",0,0,"no OA, no intervention, no SI",0,,,,,0.1877144925
369,What about our responsibility toward the abandoned elderly?,"There are many who believe that each of us is by destiny cast into specific roles to make our individual contributions to our families, our fellows, and our society. Be it destiny or circumstance, it is fortuitous that Donald P. Kent chose sociology as his field of interest, that he further chose aging as his subject area, and that, in practice, he became a teacher and administrator of social policy. My theme for this address has been chosen with Donald Kent's humane philosophies in mind. I shall suggest that there is an urgent need to take future-facing measures in national planning and policy making instead of depending upon backward-facing measures. In order to do this, I think we must be prepared to reformulate policies and approaches which prove, in practice, to be faulty or fail to achieve their goal. This will involve asking questions as: Why did a policy fail? Could the failure have been foreseen and prevented? How might the gerontological community and this society have intervened at a propitious moment when the policies and procedures were first being generated to assure that they were sound and could be successfully implemented? The deinstitutionalization of elderly mental patients is the specific policy I will use to develop my thesis. I have chosen this policy not only because of its importance or because it is an isolated instance of a catastrophe in policy implementation, but rather because the goal of the policy was humane and because I believe that if forward-facing measures had been taken, the program could have succeeded and much of the misery of the unintended abandonment of many old people could have been avoided.",0,0,"not SI, no tech",1,,,,,0.8228790211
14,"The Silver Line Helpline: A ""childLine"" for older people","Purpose - The purpose of this paper is to describe the work of the new, free telephone helpline The Silver Line in empowering older people to overcome social isolation and loneliness, and where appropriate refer cases of abuse and neglect to specialist services.Design/methodology/approach - Beginning with a family member's description of how the helpline made a difference to her relative this paper then outlines the rationale, methods and outcomes of The Silver Line, including a role it may play in reducing demand for NHS services.Findings - The paper highlights that social isolation and loneliness can be tackled through a helpline which leaves control firmly in the hands of callers while offering them a gateway to activities and services.Practical implications - It seems that telephone contact is a particularly helpful way for isolated people to begin to build social contact given that there is evidence of a stigma associated with admitting to loneliness.Social implications - Given a straightforward way to connect to others, people are empowered to overcome their own loneliness, improve their well-being and sometimes to rejoin their community. The charity reports that callers to the helpline may themselves become volunteer befrienders (""Silver Line Friends"") providing support to others and gaining evidence of their own value to society. In addition, a friendly chat over the phone can be an enabling link to gaining new skills, such as computer literacy, which may otherwise seem out of reach or irrelevant.Originality/value - The paper emphasises the importance of this helpline specifically and the wider need for hard to reach, isolated older people to have an accessible stepping stone to greater social contact and a higher quality of life. © Emerald Group Publishing Limited.",0,1,no intervention,0,,,,,0.8599686589
263,Practical issues related to the implication of elderlies in the design process-The case of a Living Lab approach for designing and evaluating social TV services,"Ageing well at home cannot be reduced to the management of physical and cognitive frailties and technologies should also tackle the quality of life of the elderly by fostering their social interactions especially for those who are living alone. The Internet could play a role in alleviating elderly loneliness, in order to cope with their social frailty. But designing appropriate services and ensuring their adoption by the elderlies remain open questions. We try to provide answers at the methodological and practical levels by reflecting on an approach based on the participation of the future users as part of a ""Living Lab"". For so doing, we report feedback from our work in a European project aiming at developing and evaluating social TV services. Our return on experience contributes to recommendations for an effective implication of elderly people in the design and evaluation process. © 2015 AGBM.",0,0,not SI,1,,,,,0.03783690511
301,Factors associated with perceived health in older adult Irish population,"Objectives: Perceived health status or self-reported health declines with age and is associated with increased morbidity, mortality, poor mental health and functional outcomes and health care utilisation. The aim of this study was to investigate the relationship between a range of biopsychosocial measures and self-reported health in a sample of community-dwelling older people living in Dublin. Method: A total of 492 participants with a mean age of 72.5 (SD=7.34) were assessed at the Technology Research for Independent Living (TRIL) clinic, a comprehensive geriatric assessment facility in St James's Hospital, Dublin, using standardised measures of medical morbidity, personality, functional status, depression, anxiety, perceived stress, cognition, loneliness and social support. The relationship between self-rated health and health measures was analysed using bivariate correlations and backward multiple regression. Indirect pathways of effects on perceived health were evaluated using bootstrapping mediation analysis. Results: Self-rated health was best predicted by instrumental activities of daily living (IADL), Charlson Co-morbidity Index (CCI), extraversion and perceived stress. The effects of cognition and social support from friends on self-rated health were found to be mediated by elements of these identified factors. Conclusion: Self-rated health is not simply the absence of physical illness but is also strongly influenced by the degree of functional impairment, personality factors and the level of stress experienced by the older person. © 2012 Taylor & Francis.",0,0,"not SI, no tech",1,,,,,0.4004253033
96,To a Deeper Understanding of Loneliness amongst Older Irish Adults,"Loneliness can play a significant role in the wellbeing of older adults. This article describes a qualitative method for using case notes from the clinical records of older individuals in order to investigate the priority concerns spontaneously reported by older adults to deepen our understanding of both the context in which reported loneliness occurs in Ireland and the potential triggers. The participants in this study represent a cross-section of older adults who participated in the Technology Research for Independent Living Clinic (TRIL). Data were collected from participants through interviewer case notes at the TRIL centre in St James's hospital, Dublin. 624 participants (431 females; 193 males) ranging in age from 60-92 years (Mean 73 years, SD 7 years) took part in the study. All were community dwelling and provided consent. A thematic analysis from grounded theory was used to evaluate the case notes for each participant. Preliminary results highlight the richness of phenomenological experience to enhance our understanding of loneliness and provide an opportunity to better understand the precursors and variability that loneliness may take. In this study we found themes in the case note analysis linking social loneliness with self-imposed limitations on social engagement due to declining health while predominate themes for emotionally lonely focused on psychological issues of stress and anxiety associated with adverse life events. The results suggest the importance of case notes to inform clinical practice. Qualitative results provided insights into differing live events of older Irish adults, which help distinguish the causal differences between social and emotional loneliness.",0,0,no tech,1,,,,,0.07712502745
365,The elderly subject and social violence: the body as a factor in communication [Le sujet âgé et la violence sociale: le corps comme facteur de communication.],"The social inferiority of an elderly person stems from his physical inferiority--actual or alleged but always possible. And yet this ""inferior"" body is paradoxically hypertrophic: at first it masks the person, then takes up its space until it negates it. Hence, an elderly person is not only a body but a lonely body. In his relations with other people, his body becomes a receiver, a receptacle and a source of communication. Social violence underlies relations with elderly people: such violence may be deceptive, widespread and continuous or, on the other hand, manifest, episodic and conspicuous. In the first case it may be a way of assigning subalternate roles to them in relation to the efficiency expected of them or a way of mythologizing their condition as one of pseudo-happiness. In the second case is generally relates to assaults, thefts, bag-snatching, etc. In any case, however, communication with them entails violence: their body perceives this and reacts to it. This is why their body's language is violent: their body cries out, it is stunned and it is acted upon (even--and unavoidably--in relations with a therapist).",0,0,"not SI, no tech",1,,,,,0.1115215861
178,Examining social isolation by gender and geography: Conceptual and operational challenges using population health data in Canada,"In 2003, the Canadian Federal/Provincial/Territorial Task Force on Seniors identified social isolation as an important issue for further study and policy development given that socially isolated persons are considered to be more vulnerable to both inappropriate use of the health care system and poorer health outcomes. In order to provide adequate support to this vulnerable population, it is critical to untangle the complex web of relationships that influence the need for care, and the health status and service utilization patterns of socially isolated older adults. Using data from the 2000-01 Canadian Community Health Survey (CCHS), this article explores social isolation as a multidimensional social construct examining in particular the axes of gender and geography to try to tease out some of this complexity and its relationship to health status and service utilization. When individual characteristics like gender are considered together with broader contextual variables like place of residence, a more comprehensive and layered portrait of vulnerability among socially isolated persons begins to emerge with insights into their unique patterns of health and service use. For example, home care may be an extremely critical resource for keeping older women in their homes and out of hospital. On the other hand, among socially isolated older men, those living in rural communities may be particularly 'invisible', neither benefiting from home care nor having strong social supports. It seems plausible then that both men and women may be in need of special interventions or targeted programmes to help them to remain, or to become, more socially integrated in their communities as they age in place. In addition, this article addresses some of the limitations of using both a quantitative analytic approach and the CCHS dataset itself in grappling with such complexity.",0,0,no tech,1,,,,,0.7326310749
353,"Risk factors for late-life suicide: A prospective, community-based study","Despite the fact that people age 65 and older have the highest rates of suicide of any age-group, late-life suicide has a low prevalence, making it difficult to conduct prospective studies. The authors examined risk factors for late-life suicide on the basis of general information collected directly from older subjects participating in a community-based prospective study of aging, the Established Populations for Epidemiologic Studies of the Elderly. Demographic variables, presence of a relative or friend to confide in, alcohol use, and sleep quality were assessed at baseline interview. Baseline and follow-up data were used to determine physical, cognitive, and affective functioning, as well as medical status. Of 14,456 people, 21 committed suicide over the 10-year observation period. Depressive symptoms, perceived health status, sleep quality, and absence of a relative or friend to confide in predicted late-life suicide. Suicide victims did not have greater alcohol use and did not report more medical illness or physical impairment. This study provided additional information about the context of late-life depression that also contributes to suicidal behavior: poor perceived health, poor sleep quality, and limited presence of a relative or friend to confide in.",0,0,"not SI, no tech",1,,,,,0.2694844205
